"1513555670.2507267","http://abcnews.go.com/US/wireStory/latest-ripple-effect-airport-power-outage-51850104","US"," The Latest on the power outage at Hartsfield-Jackson Atlanta International Airport (all times local): 6:55 p.m. Georgia Power says that it expects power to be restored at the Hartsfield-Jackson Atlanta International Airport by midnight. In a news release Sunday evening, the utility said the ""the issue may have involved a fire which caused extensive damage in a Georgia Power underground electrical facility."" The cause of the fire was not known, the statement says, but it impacted underground facilities and substations serving the airport. Georgia Power spokeswoman Holly Crawford had said earlier that only the airport had been affected by the outage. All incoming and outgoing flights at the airport have been halted since early Sunday afternoon. ——— 6:15 p.m. Airports in Chicago are among those affected by a power outage at the Hartsfield-Jackson Atlanta International Airport. Dozens of Atlanta flights to and from O'Hare International Airport and Midway International Airport were listed as cancelled heading into the evening. Chicago and Atlanta are two of the busiest airports in the U.S. Information posted on the website of the Chicago aviation department said 25 flights had been cancelled at O'Hare and 13 at Midway. It didn't say if all those flights were cancelled because of what's happening in Atlanta. The aviation department also said average delays at both O'Hare and Midway were about 15 minutes — though it didn't say if there was a direct link to the problems in Atlanta and the delays in Chicago. ——— 2:30 p.m. Authorities say a power outage at the Hartsfield-Jackson Atlanta International Airport has caused flights to be suspended. Airport spokesman Reese McCraine says the outage occurred early Sunday afternoon. He says all airport operations are being affected and that outgoing flights were halted. McCraine says some incoming flights are being diverted to other airports in the region. He says the airport is working quickly to fix the issue. McCraine says the cause of the outage is unknown. Georgia Power said it was working to find out the cause and restore electricity."
"1513555670.4183488","http://www.themercury.com.au/news/breaking-news/teenager-killed-in-rural-nsw-car-rollover/news-story/948caf7f0f345848da9d75668af55b7a","AU","An 18-year-old man has died after losing control of his four-wheel drive and rolling it several times in western NSW. A passing driver found the teen's Toyota Landcruiser on the side of a Coolabah road, near Nyngan, about 9.30am on Sunday and called emergency services. The man was airlifted from the scene but died en route to hospital, police said. Originally published as Teenager killed in rural NSW car rollover"
"1513555671.7354069","https://www.dailytelegraph.com.au/north-korea-sydney-man-59-charged-with-acting-as-economic-agent-for-rogue-state/news-story/a4cc59e1c9ef46525b9fda320ef548fb","AU","INTELLIGENCE experts remain perplexed over the alleged actions of an Australian man accused of trying to sell weapons for North Korea. Chan Han Choi was attempting to broker illicit deals that could have generated “tens of millions of dollars” for North Korea, the Australian Federal Police (AFP) allege. The man, who police allege is a “loyal agent of North Korea”, has been charged with trying to sell missile parts and technology on the black market to raise money for Pyongyang in a breach of international sanctions. The AFP said the 59-year-old, who was born in South Korea, was involved in discussions to set up a ballistic missile production facility and the supply of missile construction plans in addition to components, software and the transfer of technical expertise from Pyongyang. This is the first time charges have been laid under the Commonwealth Weapons of Mass Destruction Act and for violating UN sanctions against North Korea in Australia. Intelligence experts can’t explain how the man may have fallen under the influence of the North Korean regime, but said it suggests the rogue nation has sleeper agents and sympathisers operating across the world. Lowy Institute international security director Dr Euan Graham told ABC’s AM program North Korea relies on informal networks in Australia because there is no embassy here. “This may have been as good as it gets for Pyongyang in order to fulfil that backroom economic function whether it’s over the table or under the table,” he told AM. “In this case it appears to have been more under the table ... as an export platform and way of generating hard currency which is always near the top of North Korea’s needs.” Dr Graham said this also appears to be a one-man operation when he allegedly set himself up as a broker for North Korea, but what took the temperature up was the involvement of missile technology. He said it was unclear how Choi allegedly became swayed and it was complicated because he was originally a South Korean national. “We’re not sure exactly of the process and what made him a sympathiser to the North Korean cause,” Dr Graham said. He added there were a small number of these sympathisers and groups and fellow travellers to North Korea who were sympathetic to the regime. “We’re not talking about a large-scale movement or organised network,” he said. Professor Greg Barton, from Melbourne’s Deakin University, told the ABC he believed the likely buyer of any technology would ultimately be nation states. Police haven’t disclosed who he was allegedly attempting to sell the weapons technology to. “Well historically we’ve seen dealings between Pakistan and North Korea ... but there are many parties that would interested in looking for North Korean technology,” he said. “There are people in the middle broking on a for-profit basis so at the end of the day there has to be a buyer that wants to use the technology, so the end client is likely to be a nation state.” ‘LOYAL AGENT’ AFP Assistant Commissioner Neil Gaughan said the case was “like nothing we have ever seen on Australian soil”, alleging that the man was in contact with high-ranking North Korean officials. “This man is a loyal agent of North Korea, believing he was acting to serve some higher patriotic purpose.” The alleged agent’s plans did not involve other governments or officials, police said. Authorities did not reveal which individuals or entities the man was allegedly trying to trade with. North Korea is under tough United Nations sanctions aimed at choking off revenue to Pyongyang’s nuclear and missile programs. “This is a very important arrest. The charges laid are of the greatest nature,” Prime Minister Malcolm Turnbull said yesterday. “North Korea is a dangerous, reckless, criminal regime threatening the peace of the region. It supports itself by breaching UN sanctions. “It is vitally important that all nations ... enforce those sanctions because the more economic pressure that can be brought on North Korea, the sooner that regime will be brought to its senses.” Choi allegedly used encrypted communication services to facilitate the attempted trades, which included the transfer of coal from North Korea to entities in Indonesia and Vietnam. Choi was refused bail yesterday after being arrested in the Sydney suburb of Eastwood on Saturday. He faces a total of six charges, with maximum penalties of up to 10 years in jail. Police revealed they began looking into his activities earlier this year after a tip-off from a “foreign law enforcement partner”, Mr Gaughan said. Police would not rule out further charges, and were probing other attempted commodity trades involving oil and gemstones, as well as investigating Choi’s activities as far back as 2008. Global anxiety about North Korean leader Kim Jong-un’s authoritarian government has steadily risen this year, with Washington calling on other UN members to cut ties with Pyongyang in order to squeeze the secretive regime. — With AFP Originally published as North Korean sympathisers ‘everywhere’"
"1513555672.5887377","http://www.themercury.com.au/news/breaking-news/four-dead-in-un-food-program-ambush/news-story/ee0b314eb40a8ec64d41562b434e0522","AU","Four people have been killed as a United Nations World Food Program (WFP) aid convoy was ambushed in northeast Nigeria, in the latest attack in the region as the conflict with Boko Haram nears its ninth year. ""WFP can confirm that a convoy escorted by the Nigerian military including WFP-hired trucks was the subject of an attack by armed groups 35km southwest of Ngala in Borno State on Saturday,"" the organisation said in a statement. ""Four people, including the driver of a WFP-hired truck and a driver's assistant, were killed in the incident,"" the statement said, adding that ""WFP is working with the authorities to determine the whereabouts of the trucks"". The spokeswoman declined to comment on whether the driver and assistant were WFP staff, or give details of the other two people killed. Originally published as Four dead in UN food program ambush"
"1513555677.9400632","http://www.themercury.com.au/news/national/twelve-strays-of-christmas-rspca-cat-looking-for-new-home/news-story/92d1f1f31c23101af98c9ab32a9539d2","AU"," More than 150 animals are waiting for their forever homes this holiday season.  As a part of our Twelve Strays of Christmas feature, the NT News is profiling the cuddly residents of the Darwin RSPCA Shelter.  Like her namesake from that famous movie, Priscilla is definitely queen of the cattery — well at least she thinks so. Priscilla has an innate nobility and majesty. She has been with the RSPCA for more than 200 days so is desperate to reclaim her true authority over a household, which she will rule with an austere gaze. Priscilla’s favourite things to do are keeping watch over her minions, world domination and being pampered. Her style of leadership is firm but fair and definitely akin to a benevolent dictatorship. Can you keep her in the manner to which she is accustomed? Help her take her rightful place on your throne this Christmas. Visit rspcadarwin.org.au to find out more information on adopting, fostering or donating. If you don’t have space in your home, you can still be a “Guardian Angel” to a homeless animal of your choice this year. Find out more information at rspcaguardianangel.com.au. Originally published as Cat queen seeks a fresh domain"
"1513555678.1441214","https://www.theguardian.com/australia-news/2017/dec/18/refugee-advocates-blockade-melbourne-port-in-protest-at-offshore-detention","UK","Protesters have blockaded Melbourne’s container port in opposition to Australia’s offshore immigration detention regime. The port – Australia’s busiest – was blockaded at three entrances on Monday morning, with protesters blocking road entrances and unveiling a banner that read: “All refugees in detention are political prisoners.” Three climbers suspended themselves above three road entrances to the port and refused to come down. “Today we are taking action against Australia’s border policy, which remains open to corporate profits, yet is violently closed to those seeking safety,” said SOS Manus spokeswoman Charlotte Lynch. “We support the calls made by refugees and ex-detainees for international sanctions to be placed on Australia until the people on Manus are free.” The protest has caused significant traffic delays around the port. Victoria police are at the site. A spokeswoman for Victoria police said there would be a police presence at the rally to maintain public safety. “People have every right to protest. However, we ask that they do so peacefully and without impacting on the rest of the community,” she said.  “Police will be monitoring the rally to ensure there are no breaches of the peace or crimes occurring.” The deal to resettle refugees from Australian detention centres on Manus Island and Nauru in the United States is progressing on both sides. Close to 200 refugees – about 60 from Manus and 130 from Nauru – will move to the US in January. Fifty-four refugees were moved in September. But the newly reinstated travel ban imposed by the US president, Donald Trump, excludes people of certain nationalities, including Iranians and Somalis, from resettlement. Iranians are the largest national group on both Manus and Nauru. The US could take up to 1,250 refugees from Australia’s offshore camps – not enough to clear them – but it’s unclear precisely how many it will ultimately accept. Australia’s return obligation – to take central American refugees from refugee camps in Costa Rica – has also begun. Thirty people from seven families have moved to Australia after several months of assessment by the immigration department. It is understood they fled gang-related violence in El Salvador and had been living in hiding before being transferred to Costa Rica. The number of refugees fleeing criminal violence in the “northern triangle” countries of El Salvador, Guatemala and Honduras has escalated in recent years: nearly 10% of the 30 million people who live in those countries have fled across borders because of extortion, rape and forced gang recruitment after decades of civil war and conflict. Most of those displaced are fleeing north towards Mexico and the US. The US runs refugee camps in Costa Rica and has brokered assistance in resettling people from there. The US refugee deal was agreed between the prime minister, Malcolm Turnbull, and former US president Barack Obama in November 2016. Trump has described the arrangement as a “dumb deal” and lambasted Turnbull over it during a fractious phone call in January. His administration, however, has insisted the deal will be upheld."
